{"company_name": "Scotiabank", "date": "29/05/2024", "location": "Toronto, Ontario, Canada", "category": "Machine Learning", "position": "Software Engineer [Scotiabank]", "job_url": "https://www.linkedin.com/jobs/view/3933412770/?alternateChannel=search&refId=o0AbxSfASVj4oVig2XFSbg%3D%3D&trackingId=MumxlQCiD5YPk6Usx9fP1w%3D%3D&trk=d_flagship3_search_srp_jobs&lipi=urn%3Ali%3Apage%3Ad_flagship3_search_srp_jobs%3B4JWZY3UZQj2sCOW8bk5rJw%3D%3D", "skills": {"Frameworks": ["RAG"], "Programming Languages": ["Python"], "Tools": ["PowerApps", "Git"], "Databases": [], "CI/CD Tools": [], "Others": ["pandas", "numpy", "PyTorch", "LangChain", "VertexAI", "AI chatbots", "process automation", "cloud delivery"]}, "job_description": "Requisition ID: 200104\n   \n\n  \n\n Join a purpose driven winning team, committed to results, in an inclusive and high-performing culture.\n   \n\n  \n\n GTA Global Technology applications Business Support & Engineering is seeking a dedicated and results-oriented Developer to join our team working on AI/ML, process automation, and cloud delivery projects. As a successful candidate, you will work on identifying and implementing new technologies to improve the existing processes of our application and business teams.\n   \n\n  \n\n**Key Responsibilities**\n* Work with stakeholders from teams across the organization to develop solutions to complex problems using AI/ML and automation.\n* Design, develop, and test Python code for AI chatbots utilizing RAG framework to answer questions on internal documents.\n* Develop flows in PowerApps to automate manual processes identified by business partners.\n\n\n**Required Qualifications**\n* Python programming experience is required; knowledge of Git and/or Python libraries (pandas, numpy, PyTorch, etc.) would be helpful.\n* Excellent communication (both verbal and written) and interpersonal skills, with the ability to effectively collaborate with diverse teams and stakeholders.\n\n\n**Nice-To-Have Skills**\n* Experience with machine learning, large language models, LangChain, VertexAI, and/or PowerApps.\n* Experience within an IT/technical project team, and an understanding of the field.\n* Industry experience is an asset (preference for banking/capital markets).\n* Experience in an Agile environment.\n\n\n**Why Is This An Amazing Opportunity**\n* You'll get a chance to develop your technical skills working with the Applied Innovation Team, which is at the forefront of implementing new technologies across the organization.\n* You'll gain real-world experience making design decisions in a highly collaborative team, applying your technical skills to solve complicated problems in a fast-paced, business environment.\n* You'll develop increased knowledge about AI, ML, and cloud technologies, opening exciting career opportunities in the rapidly evolving tech space.\n\n\n**What's in it for you?**\n* Diversity, Equity, Inclusion & Allyship-We strive to create an inclusive culture where every employee is empowered to reach their fullest potential, respected for who they are, and are embraced through bias-free practices and inclusive values across Scotiabank. We embrace diversity and provide opportunities for all employee to learn, grow & participate through our various Employee Resource Groups (ERGs) that span across diverse gender identities, ethnicity, race, age, ability & veterans.\n* Accessibility and Workplace Accommodations- We value the unique skills and experiences each individual brings to the Bank and are committed to creating and maintaining an inclusive and accessible environment for everyone. Scotiabank continues to locate, remove, and prevent barriers so that we can build a diverse and inclusive environment while meeting accessibility requirements.\n* Upskilling through online courses, cross-functional development opportunities, and tuition assistance.\n* Competitive Rewards program including bonus, flexible vacation, personal, sick days, and benefits will start on day one.\n* Community Engagement - no matter where you choose to work from; we offer opportunities for community engagement & belonging with our various programs such as hackathons, contests, cooking with friends, Humans of Digital and much more!\n\n\n Location(s): Canada : Ontario : Toronto\n   \n\n  \n\n Scotiabank is a leading bank in the Americas. Guided by our purpose: \"for every future\", we help our customers, their families and their communities achieve success through a broad range of advice, products and services, including personal and commercial banking, wealth management and private banking, corporate and investment banking, and capital markets.\n   \n\n  \n\n At Scotiabank, we value the unique skills and experiences each individual brings to the Bank, and are committed to creating and maintaining an inclusive and accessible environment for everyone. If you require accommodation (including, but not limited to, an accessible interview site, alternate format documents, ASL Interpreter, or Assistive Technology) during the recruitment and selection process, please let our Recruitment team know. If you require technical assistance, please click here . Candidates must apply directly online to be considered for this role. We thank all applicants for their interest in a career at Scotiabank; however, only those candidates who are selected for an interview will be contacted."}
{"company_name": "The Home Depot Canada", "date": "29/05/2024", "location": "Toronto, Ontario, Canada", "category": "Backend Developer", "position": "Junior Backend / Fullstack Developer (Askuity Division)", "job_url": "https://www.linkedin.com/jobs/view/3920564788/?alternateChannel=search&refId=o0AbxSfASVj4oVig2XFSbg%3D%3D&trackingId=cq%2Fb6xV8aOOiKFRuyh49mQ%3D%3D&trk=d_flagship3_search_srp_jobs&lipi=urn%3Ali%3Apage%3Ad_flagship3_search_srp_jobs%3B4JWZY3UZQj2sCOW8bk5rJw%3D%3D", "skills": {"Frameworks": ["AKKA/Pekko", "Play", "Typescript", "React", "Redux", "Observables"], "Programming Languages": ["Scala", "Python"], "Tools": ["Docker", "Kubernetes", "YAML"], "Databases": ["PostgreSQL", "Firestore", "Big Query"], "CI/CD Tools": [], "Others": ["GCP and its eco-system (GKE, Google Cloud databases and pub-sub)", "Functional programming", "SQL - OLAP", "Microservices based architecture", "HTTP and REST-based web applications"]}, "job_description": "Askuity is a Toronto-based retail analytics software company operating as an innovative new division within The Home Depot. Askuity's mission is to enable suppliers and merchants at The Home Depot to make profitable, data-driven decisions and drive real-time execution.\n   \n\n  \n\n Askuity is seeking a Back End or Full Stack Developer eager to join our growing team. As a member of the development team at Askuity, you will help drive the technical direction of our industry-leading analytics platform that has a meaningful and immediate impact on our growing customer base. If you\u2019re committed to great work and are constantly looking for ways to improve the systems you are responsible for, then we\u2019d love to hear from you.\n   \n\n  \n\n**Position Responsibilities**\n* Get deeply involved in our technical direction while delivering well-tested, performant, and maintainable code for our data powered SaaS platform\n* Gain an understanding of the real-world problems of our users to help build a great product that exceeds the expectations of our customers\n* Collaborate with product stakeholders to understand, design, and implement product features and realize our product vision to help our customers make better sense of their retail data\n* Deploy and run software in Google Cloud Platform (GCP)\n* Evaluate new technologies and assess their suitability to solve challenges of today and into the future\n\n\n**Experience/Knowledge Required**\n* Experience building service-oriented architectures and web applications \u2013 we have a lot of things that are HTTP and REST-based\n* Experienced with microservices based architecture running in a Kubernetes cluster\n* Hands-on technical expertise and demonstrated ability to design and implement reliable, scalable, high performing solutions\n* Experience working with a cloud platform and products is preferred\n* We are willing to consider new grads with some co-op experience who are interested in working on an enterprise class level platform written in Scala\n\n\n**Tech Stack**\n* Functional programming \u2013 Scala and AKKA/Pekko\n* Python\n* Play framework\n* Front End frameworks \u2013 Typescript, React, Redux, Observables, etc\n* GCP and its eco-system (GKE, Google Cloud databases (Firestore, Big Query), and pub-sub)\n* SQL \u2013 PostgreSQL, OLAP\n* DevOps \u2013 Docker, Kubernetes, YAML\n\n\n**What We Offer**\n* Hybrid work environment, with In Office Thursdays where lunch is provided!\n* Comprehensive benefits package including medical, dental, life insurance and more\n* Access to a top-up for both parental and maternity leave for up to 18 months\n* DPSP, Success Sharing and/or Management Incentive Plan, stock purchase plan\n* Tuition, professional development, and health & wellness reimbursement\n* 3 weeks of vacation plus 5 personal days to start\n\n\n ]]>"}
{"company_name": "Scotiabank", "date": "29/05/2024", "location": "Toronto, Ontario, Canada", "category": "Machine Learning", "position": "Software Engineer [Scotiabank]", "job_url": "https://www.linkedin.com/jobs/view/3933412770/?alternateChannel=search&refId=o0AbxSfASVj4oVig2XFSbg%3D%3D&trackingId=MumxlQCiD5YPk6Usx9fP1w%3D%3D&trk=d_flagship3_search_srp_jobs&lipi=urn%3Ali%3Apage%3Ad_flagship3_search_srp_jobs%3B4JWZY3UZQj2sCOW8bk5rJw%3D%3D", "skills": {"Frameworks": ["RAG"], "Programming Languages": ["Python"], "Tools": ["PowerApps", "Git"], "Databases": [], "CI/CD Tools": [], "Others": ["pandas", "numpy", "PyTorch", "machine learning", "large language models", "LangChain", "VertexAI", "Agile"]}, "job_description": "Requisition ID: 200104\n   \n\n  \n\n Join a purpose driven winning team, committed to results, in an inclusive and high-performing culture.\n   \n\n  \n\n GTA Global Technology applications Business Support & Engineering is seeking a dedicated and results-oriented Developer to join our team working on AI/ML, process automation, and cloud delivery projects. As a successful candidate, you will work on identifying and implementing new technologies to improve the existing processes of our application and business teams.\n   \n\n  \n\n**Key Responsibilities**\n* Work with stakeholders from teams across the organization to develop solutions to complex problems using AI/ML and automation.\n* Design, develop, and test Python code for AI chatbots utilizing RAG framework to answer questions on internal documents.\n* Develop flows in PowerApps to automate manual processes identified by business partners.\n\n\n**Required Qualifications**\n* Python programming experience is required; knowledge of Git and/or Python libraries (pandas, numpy, PyTorch, etc.) would be helpful.\n* Excellent communication (both verbal and written) and interpersonal skills, with the ability to effectively collaborate with diverse teams and stakeholders.\n\n\n**Nice-To-Have Skills**\n* Experience with machine learning, large language models, LangChain, VertexAI, and/or PowerApps.\n* Experience within an IT/technical project team, and an understanding of the field.\n* Industry experience is an asset (preference for banking/capital markets).\n* Experience in an Agile environment.\n\n\n**Why Is This An Amazing Opportunity**\n* You'll get a chance to develop your technical skills working with the Applied Innovation Team, which is at the forefront of implementing new technologies across the organization.\n* You'll gain real-world experience making design decisions in a highly collaborative team, applying your technical skills to solve complicated problems in a fast-paced, business environment.\n* You'll develop increased knowledge about AI, ML, and cloud technologies, opening exciting career opportunities in the rapidly evolving tech space.\n\n\n**What's in it for you?**\n* Diversity, Equity, Inclusion & Allyship-We strive to create an inclusive culture where every employee is empowered to reach their fullest potential, respected for who they are, and are embraced through bias-free practices and inclusive values across Scotiabank. We embrace diversity and provide opportunities for all employee to learn, grow & participate through our various Employee Resource Groups (ERGs) that span across diverse gender identities, ethnicity, race, age, ability & veterans.\n* Accessibility and Workplace Accommodations- We value the unique skills and experiences each individual brings to the Bank and are committed to creating and maintaining an inclusive and accessible environment for everyone. Scotiabank continues to locate, remove, and prevent barriers so that we can build a diverse and inclusive environment while meeting accessibility requirements.\n* Upskilling through online courses, cross-functional development opportunities, and tuition assistance.\n* Competitive Rewards program including bonus, flexible vacation, personal, sick days, and benefits will start on day one.\n* Community Engagement - no matter where you choose to work from; we offer opportunities for community engagement & belonging with our various programs such as hackathons, contests, cooking with friends, Humans of Digital and much more!\n\n\n Location(s): Canada : Ontario : Toronto\n   \n\n  \n\n Scotiabank is a leading bank in the Americas. Guided by our purpose: \"for every future\", we help our customers, their families and their communities achieve success through a broad range of advice, products and services, including personal and commercial banking, wealth management and private banking, corporate and investment banking, and capital markets.\n   \n\n  \n\n At Scotiabank, we value the unique skills and experiences each individual brings to the Bank, and are committed to creating and maintaining an inclusive and accessible environment for everyone. If you require accommodation (including, but not limited to, an accessible interview site, alternate format documents, ASL Interpreter, or Assistive Technology) during the recruitment and selection process, please let our Recruitment team know. If you require technical assistance, please click here . Candidates must apply directly online to be considered for this role. We thank all applicants for their interest in a career at Scotiabank; however, only those candidates who are selected for an interview will be contacted."}
{"company_name": "The Home Depot Canada", "date": "29/05/2024", "location": "Toronto, Ontario, Canada", "category": "Backend Developer", "position": "Junior Backend / Fullstack Developer (Askuity Division)", "job_url": "https://www.linkedin.com/jobs/view/3920564788/?alternateChannel=search&refId=o0AbxSfASVj4oVig2XFSbg%3D%3D&trackingId=cq%2Fb6xV8aOOiKFRuyh49mQ%3D%3D&trk=d_flagship3_search_srp_jobs&lipi=urn%3Ali%3Apage%3Ad_flagship3_search_srp_jobs%3B4JWZY3UZQj2sCOW8bk5rJw%3D%3D", "skills": {"Frameworks": ["AKKA/Pekko", "Play framework", "Typescript", "React", "Redux", "Observables"], "Programming Languages": ["Scala", "Python"], "Tools": ["Docker", "Kubernetes", "YAML"], "Databases": ["Firestore", "Big Query", "PostgreSQL", "OLAP"], "CI/CD Tools": [], "Others": ["GKE", "Google Cloud Platform", "microservices", "HTTP", "REST", "SQL", "Functional programming"]}, "job_description": "Askuity is a Toronto-based retail analytics software company operating as an innovative new division within The Home Depot. Askuity's mission is to enable suppliers and merchants at The Home Depot to make profitable, data-driven decisions and drive real-time execution.\n   \n\n  \n\n Askuity is seeking a Back End or Full Stack Developer eager to join our growing team. As a member of the development team at Askuity, you will help drive the technical direction of our industry-leading analytics platform that has a meaningful and immediate impact on our growing customer base. If you\u2019re committed to great work and are constantly looking for ways to improve the systems you are responsible for, then we\u2019d love to hear from you.\n   \n\n  \n\n**Position Responsibilities**\n* Get deeply involved in our technical direction while delivering well-tested, performant, and maintainable code for our data powered SaaS platform\n* Gain an understanding of the real-world problems of our users to help build a great product that exceeds the expectations of our customers\n* Collaborate with product stakeholders to understand, design, and implement product features and realize our product vision to help our customers make better sense of their retail data\n* Deploy and run software in Google Cloud Platform (GCP)\n* Evaluate new technologies and assess their suitability to solve challenges of today and into the future\n\n\n**Experience/Knowledge Required**\n* Experience building service-oriented architectures and web applications \u2013 we have a lot of things that are HTTP and REST-based\n* Experienced with microservices based architecture running in a Kubernetes cluster\n* Hands-on technical expertise and demonstrated ability to design and implement reliable, scalable, high performing solutions\n* Experience working with a cloud platform and products is preferred\n* We are willing to consider new grads with some co-op experience who are interested in working on an enterprise class level platform written in Scala\n\n\n**Tech Stack**\n* Functional programming \u2013 Scala and AKKA/Pekko\n* Python\n* Play framework\n* Front End frameworks \u2013 Typescript, React, Redux, Observables, etc\n* GCP and its eco-system (GKE, Google Cloud databases (Firestore, Big Query), and pub-sub)\n* SQL \u2013 PostgreSQL, OLAP\n* DevOps \u2013 Docker, Kubernetes, YAML\n\n\n**What We Offer**\n* Hybrid work environment, with In Office Thursdays where lunch is provided!\n* Comprehensive benefits package including medical, dental, life insurance and more\n* Access to a top-up for both parental and maternity leave for up to 18 months\n* DPSP, Success Sharing and/or Management Incentive Plan, stock purchase plan\n* Tuition, professional development, and health & wellness reimbursement\n* 3 weeks of vacation plus 5 personal days to start\n\n\n ]]>"}
{"company_name": "Redpanda Data", "date": "29/05/2024", "location": "Canada", "category": "Cloud Software Engineer", "position": "Software Engineer, Cloud", "job_url": "https://www.linkedin.com/jobs/view/3936885770/?alternateChannel=search&refId=RWnn6opI6avF0YFN6VsDfg%3D%3D&trackingId=w8nAP%2FGO63PRSXwg%2B7ssuQ%3D%3D&trk=d_flagship3_search_srp_jobs&lipi=urn%3Ali%3Apage%3Ad_flagship3_search_srp_jobs%3BWYYMZjUQR%2BmMnH6PSVgVOg%3D%3D", "skills": {"Frameworks": ["Kubernetes"], "Programming Languages": ["Go"], "Tools": ["Terraform"], "Databases": [], "CI/CD Tools": [], "Others": ["AWS", "Azure", "GCP"]}, "job_description": "***We are a team of doers, seasoned engineers, hackers and builders, working on the future of streaming data.***\n*Funded by premier investors including GV and Lightspeed, Redpanda is building the streaming data platform for developers. We\u2019re evolving streaming beyond the Apache Kafka\u00ae protocol into a unified \u201cengine of record\u201d that delivers a categorical reduction in complexity, wicked-fast performance, onboard Wasm transforms, and transparent tiered storage that gives consumers access to both real-time and historical data from a single API.*\n***About the Role:***\n We are continuing to invest and grow our Cloud Engineering team at Redpanda. We are looking for a Cloud Software Engineer who is up for the challenge to not only build the systems but to lift Redpanda into the public cloud space, but also shape the technical culture that creates these systems. There are exciting challenges to solve and opportunities to learn from the very best. Come join us to partner closely with product and cross functional engineering teams to build and design together, the very best present and future of real-time data.\n   \n\n  \n\n***You Will:***\n* Work with all the engineering teams on building new services to be deployed across all of our supported clouds\n* Automate the infrastructure lifecycle on Kubernetes and monitor our services with the goal of offering a reliable, scalable, and high-performance SaaS\n* Make resilience and observability integral to the system, enabling us to run a managed, cloud-based streaming-as-a-service with >99.9% uptime\n* Build & design Redpanda\u2019s cloud infrastructure with reliability and performance in mind\n* Build tools & services to allow automated infrastructure provisioning and self-healing, including deployments and upgrades\n* Participate in on-call rotations, working to keep customer workloads running and incident-free\n* Build control planes based on Kubernetes for our multi-cloud, managed streaming-as-a-service offering\n\n\n***You Have:***\n* Expert knowledge of at least one: AWS, Azure, GCP\n* Strong understanding of Go and Kubernetes in production\n* Experience with Terraform and managing infrastructure as code\n* Experience building SaaS products\n* Willingness to participate in on-call rotation\n* Comfortable working with 100% distributed engineering team\n* Experience managing infrastructure predictably through GitOps and IaC. Note that this is not a pure \"devops\" role; you will need more than scripting experience in order to qualify\n* Excellent written communication skills\n\n\n**Nice to have:**\n* Experience building and operating an IaaS platform\n* Operated and used streaming platforms either as a user or provider\n* Cloud engineering experience\n\n\n*U.S. base salary range for this role is $185,000 - $218,000 (CA, NY, WA) and $177,000 - $208,000 (other US locations). Our salary ranges are determined by role, level, and location. As a remote-first company, we strive to consider each candidate's job-related skills, location, experience, relevant education or training to determine individual base salary. Your talent partner will share more about the specific salary range for your preferred location during the hiring process.*\n*Redpanda is used by Fortune 1000 enterprises pushing hundreds of terabytes a day, as well as by the solo dev prototyping a React application on her laptop. Think of it as a streaming data API platform that scales with you from the smallest projects to petabytes of data distributed across the globe.\n   \n\n  \n\n Join Redpanda if you\u2019d enjoy being part of a fast-moving, 100% remote organization with team members around the globe and a culture based on trust, transparency, communication, and kindness.*"}
{"company_name": "Innodata Inc.", "date": "29/05/2024", "location": "Canada", "category": "Machine Learning", "position": "Generative AI Associate", "job_url": "https://www.linkedin.com/jobs/view/3936734677/?alternateChannel=search&refId=xt6utrNsttjjEBxhwGUJbw%3D%3D&trackingId=AcLyW2Q6IRZdtsBKyyuDGA%3D%3D&trk=d_flagship3_search_srp_jobs&lipi=urn%3Ali%3Apage%3Ad_flagship3_search_srp_jobs%3BWYYMZjUQR%2BmMnH6PSVgVOg%3D%3D", "skills": {"Frameworks": [], "Programming Languages": [], "Tools": [], "Databases": [], "CI/CD Tools": [], "Others": []}, "job_description": "**About the role:** \n\n\n\n\n At Innodata, we\u2019re working with the world\u2019s largest technology companies on the next generation of generative AI and large language models (LLMs). We\u2019re looking for smart, savvy, and curious Generative AI Associates to join our team.\n \n\n\n\n  \n\n\n\n\n\n This is the role that writers and linguists dream about: you\u2019ll be teaching the next generation of LLMs about what makes language special. We\u2019re training generative AI how to think, not just how to write.\n \n\n\n\n  \n\n\n\n\n\n This isn\u2019t just a job: it\u2019s a once-in-a-lifetime opportunity to work on the frontlines of generative AI. There\u2019s nothing more cutting-edge than this. Joining us means becoming an integral member of a global team shaping high-quality, user-centric AI knowledge models that will be the foundation for the next wave of generative AI-powered computation platforms. Keen to learn more?\n \n\n\n\n  \n\n\n\n\n\n**What you\u2019ll be doing:** \n\n\n\n\n As a Generative AI Associate on our AI Large Language Models (LLMs) team, you will be joining a truly global team of subject matter experts across a wide variety of disciplines and will be entrusted with a range of responsibilities. We\u2019re seeking self-motivated associates who can handle the speed required to be on the frontlines of innovation. In return, we\u2019re happy and excited to train you in unlocking the potential of generative AI. Below are some responsibilities and tasks of our Generative AI Associate role:\n \n\n\n* Creating training data sets for AI models that will help improve their accuracy, fluency, coherence and/or voice\n* Annotating data to help AI models align with human values\n* Analyzing and improving the grammar, syntax, and sentence structure of both expert-\n* generated training data and AI model-generated text to ensure it adheres to linguistic rules and conventions\n* Collaborating closely with cross-functional teams, including data scientists, researchers, and software engineers to refine and iterate data sets\n* Contributing to evolving specifications for AI-model training and data recipes\n* Navigating a dynamic environment and adapting to shifting guidelines and flexible\n* priorities\n* Achieving target KPIs, including daily job count and average handle time per job, within\n* specified data production windows\n\n\n\n  \n\n\n\n\n\n**What we need you to bring:** \n\n\n\n* Bachelor\u2019s degree in Linguistics, Journalism, Creative Writing, English or similar\n* Excellent writing skills (in English)\n* Strong understanding of grammar, syntax, and semantics\n* Ability to edit and improve written communication across a wide variety of fields\n* Creative thinker\n* Strong attentive to detail\n* Well-honed internet research skills\n* Ability to embraces diverse teams\n* Navigates ambiguity with grace\n* Adaptability to thrive in a dynamic environment, with the agility to adjust to evolving\n* guidelines and fluid priorities\n\n\n\n  \n\n\n\n\n\n**What we offer:** \n\n\n\n* Fully remote work environment\n* Collaborative culture \u2013 and key tools enabling it\n* Competitive compensation package\n* Health, dental & vision benefits\n* Employee Assistance Program (EAP)\n* Career development & progression opportunities\n* Paid vacation & personal days as well as sick days\n\n\n\n  \n\n\n\n\n\n Actual compensation will be determined based on various factors including qualifications, experience, and internal equity."}
{"company_name": "Curtiss-Wright Corporation", "date": "29/05/2024", "location": "Ottawa, Ontario, Canada", "category": "Software Developer", "position": "Software Developer", "job_url": "https://www.linkedin.com/jobs/view/3936353415/?alternateChannel=search&refId=xt6utrNsttjjEBxhwGUJbw%3D%3D&trackingId=UFxPO67HGgDSliNOw98sRQ%3D%3D&trk=d_flagship3_search_srp_jobs&lipi=urn%3Ali%3Apage%3Ad_flagship3_search_srp_jobs%3BWYYMZjUQR%2BmMnH6PSVgVOg%3D%3D", "skills": {"Frameworks": ["Linux BSPs", "VxWorks BSPs"], "Programming Languages": ["C"], "Tools": ["Git", "JIRA"], "Databases": [], "CI/CD Tools": [], "Others": ["Python", "Linux OS distributions such as (Red Hat Enterprise, CentOS Stream, Alma, Fedora, and YOCTO)", "Das U-Boot or UEFI/BIOS firmware development", "Software configuration management tools", "Software work and defect tracking tools", "Software test tools and methodologies", "Scripting tools and languages", "Requirements analysis and tracking", "Use of HW debugging tools, such as Digital Analyzers, Oscilloscopes, and DMMs", "Hobby projects with Raspberry Pi and/or Arduino"]}, "job_description": "**Software Developer-Onsite Position-Ottawa, ON**\n We have a rewarding opportunity for a\n ***Software Developer***\n to join our world class manufacturing facility in\n ***Ottawa, ON***\n As one of our Software Developers, you are responsible for all aspects of software development; you must be resourceful and able to overcome new challenges using insightful design and engineering skills coupled with innovative approaches. In a nutshell, we need your sharp expertise to help define new embedded products, implement product enhancements and contribute to process improvements.\n   \n\n  \n\n**Location:** \n***Ottawa, ON***\n**We Take Care of Our People**\n Paid Time Off\n **I** \n RRSP with Employer Match\n **I** \n Health and Wellness Benefits\n **I** \n Learning and Development Opportunities\n **I** \n Competitive Pay\n **I** \n Referral Program\n **I** \n Recognition\n **I** \n Employee Stock Purchase Plan\n **I** \n Inclusive & Supportive Culture \\*\n   \n\n  \n\n**Your Challenge**\n* Engineer, Design, Develop and Test new embedded products at the forefront of technology.\n* Support and enhance existing embedded software.\n* Apply established development processes and assist in process improvement.\n* Analyze requirements, research and identify solutions and develop the design.\n* Conduct architecture, design and code reviews.\n* Provide input to architecture and design reviews.\n* Provide input and evaluation of new technologies and products.\n* Keep current with embedded software trends and share knowledge.\n* Reading and understanding IC datasheets, register descriptions and board schematics.\n* Participate in maintaining a positive and productive atmosphere within the team.\n\n\n**What You Bring**\n* Development of real-time embedded software solutions for Intel, Power Architecture and Arm processors.\n* Proficient using the high-level programming language such a C to solve computing problems.\n* Strong sense of responsibility, commitment to quality and achieving deadlines and be a driven and motivated self-starter with a keen interest to learn.\n* Strong understanding of software design and engineering principals and application to real world use.\n* Results-oriented team player who leads by example, holds themselves accountable for performance, takes ownership of their responsibilities, and champions process improvement initiatives\n* Bachelor's Degree in Engineering or Computer Science (or equivalent).\n\n\n* Experience/familiarity in the following is an asset:\n+ Experience working with a multi-disciplined team\n+ Knowledge of software engineering best practices and standards.\n+ Focus on writing supportable, portable code.\n+ Linux BSPs and device driver development\n+ VxWorks BSPs and VxBus device driver development\n+ Linux OS distributions such as (Red Hat Enterprise, CentOS Stream, Alma, Fedora, and YOCTO)\n+ Das U-Boot or UEFI/BIOS firmware development\n+ Software configuration management tools such as Git.\n+ Software work and defect tracking tools such as JIRA.\n+ Software test tools and methodologies.\n+ Scripting tools and languages such as Python.\n+ Requirements analysis and tracking.\n+ Use of HW debugging tools, such as Digital Analyzers, Oscilloscopes, and DMMs.\n+ Hobby projects with Raspberry Pi and/or Arduino\n\n\n**Who We Are**\n Curtiss-Wright creates a wide variety of embedded computer products designed for the rugged defense industry. Our customers want the latest cutting-edge consumer technology adapted to a rugged form factor and our mission is to make that a reality! As part of a dynamic multi-disciplined team, your job will be to support the development of new embedded systems products, and to enhance our existing products.\n   \n\n  \n\n To learn more visit: https://www.curtisswrightds.com/about/company/locations/ottawa\n   \n\n  \n\n*No unsolicited agency submittals please. Agency partners must be invited to participate in a search by our\n **Talent Acquisition Team** \n and have signed terms in place prior to any submittal. Resumes submitted directly to any Curtiss-Wright employee or affiliate will not qualify for fee payment, and therefore become the property of Curtiss-Wright.*\n**Compliance Statement**\n This position may require exposure to export-controlled information and subject to additional security screening. In the event information provided during the security screening reveals ineligibility to access export-controlled information, any offer of employment may be reconsidered or withdrawn.\n   \n\n  \n\n Curtiss-Wright values diversity in the workplace. All qualified applicants will receive consideration for employment without regard to race, color, religion, sex, sexual orientation, gender identity, national origin, disability or protected veteran status.\n   \n\n  \n\n If you require accommodation due to a disability at any time during the recruitment and/or assessment process, please contact Talent Acquisition and we will make all reasonable efforts to accommodate your request."}
{"company_name": "Scotiabank", "date": "29/05/2024", "location": "Toronto, Ontario, Canada", "category": "Data Engineering", "position": "Data Analyst, Compliance and AML, Data Analytics [Scotiabank]", "job_url": "https://www.linkedin.com/jobs/view/3936653551/?alternateChannel=search&refId=xt6utrNsttjjEBxhwGUJbw%3D%3D&trackingId=a4yIEQoLxjFsmM7Au%2F%2Fd7Q%3D%3D&trk=d_flagship3_search_srp_jobs&lipi=urn%3Ali%3Apage%3Ad_flagship3_search_srp_jobs%3BWYYMZjUQR%2BmMnH6PSVgVOg%3D%3D", "skills": {"Frameworks": [], "Programming Languages": ["SQL", "R", "Matlab", "Python"], "Tools": ["Power BI", "Tableau"], "Databases": [], "CI/CD Tools": [], "Others": ["XML", "JSON", "flat files", "statistical analysis", "machine learning"]}, "job_description": "Requisition ID: 200037\n   \n\n  \n\n Join a purpose driven winning team, committed to results, in an inclusive and high-performing culture.\n   \n\n  \n\n Reporting to the Senior Manager, Reporting and Analytics the Data Analyst will contribute to the overall success of our team and work closely with business analysts, data scientists and data engineers to address business opportunities. The Data Analyst will have to understand the business needs and requirements to support and enhance our analytics function. This individual has a passion for data, analytics, and crafting business solutions within Compliance and AML.\n   \n\n  \n\n**Is this role right for you? In this role, you will:**\n* Champion a customer focused culture to deepen client relationships and leverage broader Bank relationships, systems and knowledge.\n* Provide technical and analytical expertise in designing and implementing data pipelines.\n* Plan and facilitate discussions with business clients to gather business, data source requirements, and use cases to support advanced analytics and modeling.\n* Create dashboards to share data insights with the business, builds data features used for modeling, reporting and advanced analytics.\n* Build and maintain proper documentation, data lineage and extract-transform-load (ETL) processes.\n* Maintain a good understanding of the Bank's business strategies, policies, risk management and IT processes and disciplines.\n* Understand how the Bank's risk appetite and risk culture should be considered in day-to-day activities and decisions.\n* Actively pursue effective and efficient operations of their respective areas in accordance with Scotiabank's Values, its Code of Conduct and the Global Sales Principles, while ensuring the adequacy, adherence to and effectiveness of day-to-day business controls to meet obligations with respect to operational, compliance, AML/ATF/sanctions and conduct risk.\n* Champion a high-performance environment and contributes to an inclusive work environment.\n\n\n**Skills**\n**Do you have the skills that will enable you to succeed? We'd love to work with you if you have experience with:**\n* University degree and/or college diploma in relevant STEM discipline (Computer Sciences, Electrical/ Computer/ Software Engineering, Mathematics).\n* 2+ years of experience in cleaning, transforming and visualizing data sets working from various data formats (e.g., unstructured logs, XML, JSON, flat files).\n* Have hands-on programming experience and advanced knowledge of SQL.\n* Experience with agile methodologies, implementing and managing visualization tools such as Power BI, or Tableau.\n* Excellent communication skills, with a strong customer-focus.\n* Experience with statistical analysis and machine learning with common machine learning libraries in R, Matlab and/or Python.\n\n\n**What's in it for you?**\n* In-depth training to prepare you for the role, as well as ongoing coaching and feedback to help you succeed!\n* You'll be part of a diverse, collaborative, innovative, and high-performing team\n* We offer a competitive rewards package:\n* Performance bonus, Employee Share Ownership Program, and Pension Plan Matching\n* Health Benefits from day one!\n* You will relish work-life balance, team events, and opportunities to participate in the community.\n* Your career matters! You will have access to career development and progression opportunities.\n\n\n Location(s): Canada : Ontario : Toronto\n   \n\n  \n\n Scotiabank is a leading bank in the Americas. Guided by our purpose: \"for every future\", we help our customers, their families and their communities achieve success through a broad range of advice, products and services, including personal and commercial banking, wealth management and private banking, corporate and investment banking, and capital markets.\n   \n\n  \n\n At Scotiabank, we value the unique skills and experiences each individual brings to the Bank, and are committed to creating and maintaining an inclusive and accessible environment for everyone. If you require accommodation (including, but not limited to, an accessible interview site, alternate format documents, ASL Interpreter, or Assistive Technology) during the recruitment and selection process, please let our Recruitment team know. If you require technical assistance, please click here . Candidates must apply directly online to be considered for this role. We thank all applicants for their interest in a career at Scotiabank; however, only those candidates who are selected for an interview will be contacted."}
{"company_name": "UST", "date": "29/05/2024", "location": "Toronto, Ontario, Canada", "category": "Machine Learning", "position": "Machine Learning Engineer", "job_url": "https://www.linkedin.com/jobs/view/3936352818/?alternateChannel=search&refId=xt6utrNsttjjEBxhwGUJbw%3D%3D&trackingId=cs2jEWHkTlzz6VaVt1P9yw%3D%3D&trk=d_flagship3_search_srp_jobs&lipi=urn%3Ali%3Apage%3Ad_flagship3_search_srp_jobs%3BWYYMZjUQR%2BmMnH6PSVgVOg%3D%3D", "skills": {"Frameworks": ["HuggingFace"], "Programming Languages": ["Python"], "Tools": ["Azure", "Aws", "Docker", "Kubernetes", "terraform", "Databricks"], "Databases": [], "CI/CD Tools": [], "Others": ["CUDA", "MLops", "NLP", "BERT", "Agile development methodology"]}, "job_description": "**Role Description**\n**Machine Learning Engineer**\n**Lead I \u2013 ML Engineering**\n**Who We Are**\n Born digital, UST transforms lives through the power of technology. We walk alongside our clients and partners, embedding innovation and agility into everything they do. We help them create transformative experiences and human-centered solutions for a better world.\n   \n\n  \n\n UST is a mission-driven group of over 39,000+ practical problem solvers and creative thinkers in over 30+ countries. Our entrepreneurial teams are empowered to innovate, act nimbly, and create a lasting and sustainable impact for our clients, their customers, and the communities in which we live.\n   \n\n  \n\n With us, you\u2019ll create a boundless impact that transforms your career\u2014and the lives of people across the world.\n   \n\n  \n\n Visit us at UST.com.\n   \n\n  \n\n**You Are**\n UST is looking for a Machine Learning Engineer to join our Alternate Data & AI team to help build systems that accelerate the development and deployment of machine learning models, especially large language models (LLMs). You will partner closely with Machine Learning researchers and internal users to understand requirements and apply your own domain expertise to build high performance and reusable APIs.\n   \n\n  \n\n The ideal candidate is someone who has strong ML fundamentals and can also apply them in real production settings. This role has a core focus on optimizing inference and fine tuning for LLMs. They should also be comfortable with infrastructure and large-scale system design, as well as diagnosing both model performance and system failures.\n   \n\n  \n\n**The Opportunity**\n* Build highly available, observable, performant, and cost-effective APIs for model inference and fine tuning for LLMs.\n* Engage with ML researchers and stay up to date on the latest trends from industry and academia.\n* Participate in our team\u2019s on call process to ensure the availability of our services.\n* Own projects end-to-end, from requirements, scoping, design, to implementation, in a highly collaborative and cross-functional environment.\n* Exercise good taste in building systems and tools and know when to make build vs. buy tradeoffs, with an eye for cost efficiency.\n* Influence the data, AI and cloud journey for the bank. Influence the Sustainability roadmap for the bank.\n* Impact revenue generation thru New Business for Alternative Data\n* Mitigate reputation risk thru AI driven Data Quality to ensure highest quality data and services are offered to clients\n\n\n This position description identifies the responsibilities and tasks typically associated with the performance of the position. Other relevant essential functions may be required.\n   \n\n  \n\n**What You Need**\n* 2+ years of experience building machine learning training pipelines or inference services in a production setting.\n* Experience with LLM deployment, fine tuning, training, prompt engineering, etc.\n* Experience with LLM inference latency optimization techniques, e.g. kernel fusion, quantization, dynamic batching, etc.\n* Experience with CUDA, model compilers, and other model-specific optimizations.\n\n\n**Preferred**\n* Experience working with a cloud technology stack (eg. Azure or AWS).\n* Experience building, deploying, and monitoring complex microservice architectures.\n* Experience with Python, Docker, Kubernetes, and Infrastructure as code (e.g. terraform).\n* Experience with LLMs, MLops\n* Experience with distributed notebook environments like Databricks\n* Experience building AI driven Data Quality frameworks and other data governance tools and capabilities.\n* Experience building meta data driven AI and statistical models for repeatable insight generation.\n* Experience building front to back data pipelines comprising of data ingestion, enrichment , data quality , Analytics and reporting\n* Experience with Agile development methodology\n* Experience with company KPIs and back testing of alternative data factors against company KPIs.\n* Experience with NLP techniques and transfer learning frameworks like BERT\n* Experience with using HuggingFace Model Artifacts\n\n\n Location: Montreal / Halifax\n   \n\n  \n\n**What We Believe**\n We\u2019re proud to embrace the same values that have shaped UST since the beginning. Since day one, we\u2019ve been building enduring relationships and a culture of integrity. And today, it's those same values that are inspiring us to encourage innovation from everyone to champion diversity and inclusion, and to place people at the center of everything we do.\n   \n\n  \n\n**Humility**\n We will listen, learn, be empathetic and help selflessly in our interactions with everyone.\n   \n\n  \n\n**Humanity**\n Through business, we will better the lives of those less fortunate than ourselves.\n   \n\n  \n\n**Integrity**\n We honor our commitments and act with responsibility in all our relationships.\n   \n\n  \n\n**Equal Employment Opportunity Statement**\n UST is an Equal Opportunity Employer.\n   \n\n  \n\n All qualified applicants will receive consideration for employment without regard to race, color, religion, sex, sexual orientation, gender identity, national origin, disability, or status as a protected veteran.\n   \n\n  \n\n UST reserves the right to periodically redefine your roles and responsibilities based on the requirements of the organization and/or your performance.\n   \n\n  \n\n #UST\n   \n\n  \n\n**Skills**\n Azure,Aws,Python"}
{"company_name": "Cynet Systems", "date": "29/05/2024", "location": "Toronto, Ontario, Canada", "category": "Data Engineering", "position": "Junior Data Analytical Specialist", "job_url": "https://www.linkedin.com/jobs/view/3936891918/?alternateChannel=search&refId=xt6utrNsttjjEBxhwGUJbw%3D%3D&trackingId=qUjAV8mp8Rhzwuu39wKRjw%3D%3D&trk=d_flagship3_search_srp_jobs&lipi=urn%3Ali%3Apage%3Ad_flagship3_search_srp_jobs%3BWYYMZjUQR%2BmMnH6PSVgVOg%3D%3D", "skills": {"Frameworks": [], "Programming Languages": ["R", "Python"], "Tools": ["Excel", "Microsoft Power BI", "ArcGIS", "R Shiny", "SAS", "Python", "Esri", "Microsoft PowerBI", "PowerViewer", "Cognos"], "Databases": ["SQL databases"], "CI/CD Tools": [], "Others": ["statistical modelling", "predictive analytics", "dimensionalized data", "building cubes"]}, "job_description": "**Job Description:\n   \n\n  \n\n Responsibilities:** \n\n\n\n* Lead the development and delivery of functional and ministry-specific analytics to support evidence-based decision-making and produce actionable insights.\n* Work closely with clients groups to assess current data analytics and reporting capabilities, gather future-state requirements and identify further opportunities for improvement.\n* Facilitate decision-making and manage client expectations.\n* Own the execution of analytics initiatives including end-to- end reporting and data set delivery.\n* Develop robust statistical models and machine learning algorithms to model business scenarios and extract valid inferences.\n* Participate in documentation, development, testing, and end user training.\n* Work with functional area experts, Data Architects and ETL Developers and stakeholders to understand complex business issues and develop appropriate Business Intelligence solutions.\n* Design methods to capture, structure, transform and process data to be used to generate models.\n* Build data models that provide information which is accurate, easy to understand and unbiased.\n* Communicate complex quantitative analysis in a clear and precise manner, providing useful visuals and summaries.\n* Provide interpretation, advice, and expertise to client groups and other stakeholders, including direction on how to transform analytics into actionable information and proactive insights that support decision making.\n\n\n\n\n General Skills:\n \n\n* Excellent analytical, problem-solving and decision-making skills, verbal and written communication skills, interpersonal skills and team work skills.\n* Outstanding consulting and relationship management skills, with proven ability to elicit requirements, develop/consult on options and solutions, and provide effective guidance.\n* Adept at communicating to both technical and non-technical audiences.\n* Experience with a range of analytical methods, techniques and tools such as, but not limited to: statistical analysis and modelling, data mining, machine learning and algorithms, natural language processing, and other related disciplines at the specified experience level.\n* Ability to manipulate and analyze complex, high-volume data from structured and unstructured sources.\n* Experience developing data extraction, transformation, and load functionality for large relational and multidimensional data stores.\n* Experience designing high quality interfaces to present information in a meaningful way to end users.\n* Broad understanding of data management, financial and business analysis, database architecture, and information visualization.\n* Proficiency in query languages and experience constructing complex query statements.\n* Experience in one or more programming or scripting languages.\n* Strong investigative and logic skills. Proficiency in mathematics and statistics.\n* Awareness of emerging Business Intelligence trends and directions.\n* Functional area experience as required.\n* Experience with analytical software such as R, PowerPivot, Matlab, SPSS, or SAS an asset.\n* Proficiency with desktop analysis software including Microsoft Excel, Access, VBA.\n* A junior (Level 1) Data Scientist is required to support the assessment and analytics of datasets for proofs-of-concept.\n* The general scope of work for the data scientist involves.\n* Assessing datasets from various ministry sources, including those involved with land-use planning, child care, and school related data.\n* Identifying potential gaps (e.g. inconsistencies, errors) in datasets and documenting gaps as well as steps for resolution.\n* Identifying new datasets needed to improve analytical capabilities of a proof of concept; Developing reports in various visualization tools (e.g. GIS, Tableau, Microsoft PowerBI).\n* Conducting historical analytics on relational datasets.\n* Conducting predictive analytics on relational datasets; and.\n* Documenting the findings at each phase of work and reporting the findings to the team.\n* The candidate must be able to work in an agile/iterative project environment.\n\n\n\n\n Skills:\n \n\n* Statistical modelling using R script.\n* Experience with land-use planning, child care, StatsCan demographics, and Ontario Open Data is an asset.\n* Experience integrating R Script into Microsoft Power BI.\n* Experience with predictive analytics.\n* Experience with dimensionalized data / building cubes.\n* Experience and Skill Set Requirements:\n\n\n\n\n Tools and techniques - 55%:\n \n\n* Superior Knowledge of MS analytical products in particular Excel and data validation on Excel forms.\n* Experience with SQL databases.\n* Experience cleaning, transforming and joining data.\n* Experience is creating and applying data standards.\n* Experience with dimensional data models.\n* Statistical modeling using R and experience integrating R with Microsoft Power BI an asset.\n* Experience building visualizations in R Shiny, SAS, Python, Esri/ArcGIS, Microsoft PowerBI, and PowerViewer, Cognos an asset.\n\n\n\n\n Power BI and Analytics Experience - 20%:\n \n\n* Experience developing business intelligence and various analytics resources.\n* Experience with cleaning, transforming, integrating, and visualizing data sets.\n* Experience understanding a data model.\n* Experience creating interactive visuals.\n\n\n\n\n Communication Skills - 30%:\n \n\n* Experience in developing documentation on data standardization and requirements.\n* Demonstrated consulting and relationship management skills, with proven ability to elicit requirements, develop/consult on options and solutions, and provide effective guidance.\n* Strong verbal and written communication skills; with both technical and non-technical audiences.\n* A demonstrated team player with a track record for meeting deadlines.\n\n\n\n\n Client Experience - 5%:\n \n\n* Previous public sector experience in an organization of equivalent size and complexity to the Public Service."}
